4339	-家	2004年初,吴金贵被调入中国国家足球队,出任荷兰主教练阿里·哈恩的助理,但是很快因为对于「业务的不同意见」而离开.
4340	重-	Elijah之后由Elena取回匕首,重新立规则对付Klaus.
4343	重-	最初在1996年未上映的试播节目中罗森博格这个角色是让RiffRegan饰演,但在确定会上映并重新征选角色后,Hannigan参加了罗森博格这个角色的征选.
4347	-化,-学,可-,地-,非-	可是,吕卫伦接任会长的时候,正值英国文化协会的低潮,在1960年代,由于政府削减资助等原因,协会被迫先后结束在缅甸、斐济、加勒比海和非洲及中东部份地区的工作,并将协会的服务对象逐步缩窄至西欧地区,工作性质也限制到只有艺术、科学和科技领域的交流层面,使协会的规模不断萎缩.
4349	-化,-员,-学,大-	在出任协会会长以前,他早在1968年至1972年任英国文化协会英联邦大学交流委员会委员,因此对协会有一定认识.
4350	可-	尽管他的钱币象征意味雄厚,但在政策上可能趋向防御性质.
4353	-学,大-,第-	他是北京大学第一个讲欧洲文学史的教授.
4354	可-	但可以举一事为例,他说他喜欢涉览笔记,中国的,他几乎都看过.
4355	-们	这情况,轻一些说是他们有了自己的独有的风格,重一些说是别人办不了.
4356	第-	从第二年开始,周俊三渐转球队辅助角色,上场时间愈来愈少.
4357	-度	民国6年(1917年),段祺瑞执政,国会再度解散.
4358	重-	汪精卫从重庆脱出并受到日本保护之际,周化人归国辅佐汪.
4359	高-	1946年10月19日他被首都高等法院判处死刑,1947年(民国36年)5月上诉仍被维持原判,但迟迟未执行枪决.
4360	-学,大-	光绪三十二年(1906年)任山东大学堂总监督,任职一年.
4365	-化	最小的弟弟周渝继承爸爸的思想,将紫藤庐经营成台北市独具一格的文化茶馆,成为台北市市定古迹.
4367	高-	1912年,调任回浙江,出任浙江省高等审判厅书记官长.
4369	-化	周骏彦早年曾在家乡奉化县的龙津学堂担任学监.
4371	-们,-员,-学,-家,地-	玩家以地下军新成员与达夏取得联络,从达夏那玩家得知为针对盟军的抵抗活动已经就绪,但为我们研发新武器的苏联首席科学家却神秘失踪.
4373	-度,大-,好-	但在西元2000年以后,传媒尺度大开,许多命理节目风行,如:开运鉴定团、命运好好玩,造成命理的风行与正当化.
4376	-们	他们不分战争的社会根源,认为通过和平谈判和协商就能解决双方的暴力.
4378	-子,-性,可-,非-	而她温柔善良的个性也与和缓翁主恰好相反,比起这个同母的妹妹,她与弟弟庄献世子感情也可以说非常融洽.
4379	-头,地-,大-	和黄是业务遍布全球的大型跨国企业,经营多元化业务,包括全球多个市场最大的货柜码头经营商、零售连锁集团、地产发展与基建业务,以至电讯及电台广播服务.
4380	-度	狐狸因过度疼痛,昏死过去.
4381	好-,重-,非-	以下是一些常见的咖啡种类:咖啡粉的好坏对接下来的烹制过程有非常重要的影响.
4384	初-	咸昌里,是台湾南部自清治时期至日治初期的一个行政区划,其范围即今屏东县的车城乡北部.
4386	地-,多-	品客除了口味多样之外,还有限定贩卖地区或时间的特色口味,相当受到消费者的欢迎,而该广告亦于无线、亚视及商台播出.
4387	-家	哈公,香港作家、电影编导、传媒工作者,原名许国、许子宾,潮汕人,一说是闽南泉州人(潮州话和泉州话都属于闽南语系,和泉州话有很多完全相同,比如「你」、「鱼」、「举」、「话」、「同」等字音).
4388	-员	后来卡通造型的桑德斯上校(由演员RandyQuaid配音),出现在越来越多的肯德基广告中.
4389	小-	因相当著迷小丑,而开始分析和研究有关他的事,还疯狂地爱上他.
4390	-性	圣诞晚会上,哈利、罗恩、赫敏分别提出或接受了异性的邀请,与舞伴一起参与了晚会.
4392	-度,地-	2011年,哈尔滨实现地区生产总值4243.4亿元,比上年增长12.3%,连续9年保持12%以上的增长速度.
4393	-头	其中哈尔滨电机厂产品占全国水电工程设备数量的二分之一,火电工程设备数量的三分之一,总量的二分之一,也是三峡工程设备供应国内唯一中标单位,成为同行业龙头.
4398	-员,-者	他是瑞士著名穆斯林学者塔里克·拉马丹的外祖父,也是著名埃及美术类兄弟会成员贾麦勒·班纳(Gamalal-Banna)的哥哥.
4403	-学	自14岁起,许多哈瑞迪男孩便不再学习任何世俗的科目(科学、数学、外语),转而专注在犹太律法的研读.
4404	-度,大-,小-,高-	该处为一个小型遗址,大约150米宽,200米长,高度约7米.
4405	-子,非-	在1946年,美国本土发生了数宗残暴的私刑,其中有两名黑人男子和两名黑人妇女在乔治亚州的华尔顿县附近被杀害;另外亦有一名刚从二战战场退役的非洲裔军人遭到虐待,称为艾萨克·伍德沃德事件.
4406	-们,重-	杜鲁门是在罗斯福的身体健康每况愈下时被任命为副总统的,而任职副总统的时间只有82日,因此他们两人没有开展重要的合作.
4408	大-	其枪机是以AK-47的双大形闭锁锁耳枪机为蓝本,并且经过相当的修改使其适用于大威力的反器材步枪上.
4410	大-	参加哥德堡号建造工作的人大约有100至150人,其中约有80人是不领取任何报酬的自愿者.
4411	-化,-员,多-	这个结果来自于次文化成员多样化的喜好.
4412	可-,第-	随著冬季及冰雪的来临渡过塞尼奥河的任何企图是不可能的,第8军团在1944年的行动因而结束.
4414	-学	科学家亦发现,人在悲痛时流的眼泪和伤风感冒及风沙入眼时流的眼泪,其化学成分是不同的.
4415	大-,重-	大型的食草哺乳动物,如牛是人类早期农业的重要组成部分,几乎所有的文明的早期农业都依赖于牛等牲畜的使用.
4416	地-	宋军在王韶的率领下于该年占领唃厮啰国熙河地区,这迫使唃厮啰国与西夏联合,出兵攻打北宋的河州,杀其守将.
4417	-家,第-	从此法国成为欧洲第二个拥有住房抗告权的国家.
4418	高-	随后,唐开始集结陆海部队准备在649年再一次大规模攻高句丽.
4420	高-	玄宗虽然没有发动过像唐太宗、唐高宗朝时那样的大规模的开边军事行动.
4423	-儿,-员,-学	唐诗咏中学时开始兼职模特儿,直至2000年参演「香港电台」的电视剧《青春@Y2K》同期演员有余文乐、蔡卓妍、黎国辉等.
4425	-们,-者	唯心论直接相对于唯物论,后者认为世界的基本成分为物质,我们对世界之认识主要是通过物质,并将之视作为一种物质形式与过程.
4427	-子	魏惠王怨恨商鞅用欺骗的手段俘虏公子卬、击败魏军,将其驱逐回秦国.
4430	-们	虽然西克索人只统治埃及的北部,但整个埃及都向他们进贡.
4432	可-	在《恶灵古堡》中,植物也可以感染病毒而成为丧尸.
4435	-员	他也是首位担任公务员的英国王室成员.
4436	-子	乔治王子和玛丽娜公主的婚姻是英国王室最后一桩门当户对的婚姻.
4437	-子	玛丽娜公主生于1906年,比乔治王子年幼四岁.
4438	-子	直到1934年8月,应玛丽娜公主的姐姐奥尔加公主和姐夫保罗王子的邀请,乔治王子来到南斯拉夫才和玛丽娜公主订婚.
4439	-们,-学,大-	在这之后,他接拍了一部名为《我们是马歇尔》的电影,这部电影讲述的是大学橄榄球队中发生的故事,不过并没有获得霹雳娇娃那样的成功.
4443	-学,大-	大众被邀请参观实验室的设施,目睹实验室有关科学技术的演示.
4446	-学	1980年由陈宗仁接任,1982年配合嘉义市升格为省辖市,校名为嘉义市立民生国民中学.
4447	-员,超-	嘉莉迪在参加《超级名模生死斗》前是一位摄影师,也曾担任过演员.
4449	-地	另外,嘉薛地喜爱研究历史,二战前曾发表一些有关香港通商史和商业史的文章.
4450	-者	正传《嘉薰医生》最初是作者陈嘉薰运用自身形象进行创作.
4451	-学,第-	学校亦于1956年成立了香港的第一队香港红十字会青年团(YouthUnitOne),其后逐渐普及于其他中学,成为香港其中一个最具规模的制服团体.
4453	-手,超-	2011年1月8日,她在亚利桑那州图森市的Safeway超级市场外举办「国会就在你的街角」(CongressonYourCorner)活动时遭枪手击中头部受重伤,当时被枪手击中的另外还有18人.
4454	-性	她也是该州历史上最年轻的女性参议员.
4457	-性	而动态性质的名物化以谓语等词加上后缀/-an/等表示,其特性为词语在句中有动态语义(active)连系.
4460	-地	四川北路站周边,目前仍以20世纪建造的石库门住宅和公园绿地为主.
4461	地-	明太祖洪武四年(1371年),四川地区并入明朝版图.
4464	大-	十公主有别于一般皇室宗女,她从儿时起,便经常跟著皇父与大臣公卿会面,亦常与亲哥哥及堂兄弟们混在一起,因此熟知政务.
4466	高-	国联季后赛在NFC冠军赛两队竞争乔治哈拉斯杯达到高潮.
4468	-家	国际友谊博物馆是中华人民共和国国家文物局直属的国家级博物馆,「专门收藏、保护、研究和展示新中国对外交往中党和国家领导人受赠的外交礼品」.
4469	-学	此外还作为国际奥委会的代表进行技术监督,组织四年一度的世界射击锦标赛;促进和发展教学计划与方法、出版联合会通讯和奖励对国际射联有突出贡献的个人.
4471	-度	各国不论政治、经济、社会制度上有何差异,都有义务互相协助.
4472	-家,重-	国家有权对其在国外的本国国民的合法权益进行保护,这是国家属人优越权的重要内容之一.
4476	大-,小-	在南部环礁的一个灯塔小岛上居住著大量海鸟.
4477	-们,大-	紧随其后,他们研发了喷气动力的Tu-16轰炸机(北大西洋公约组织命名:獾Badger).
4478	-家	最初总统只是象征式的国家元首,政务由国会主持.
4479	-员,-家	虽然大部分的总统由民主方法选出,也有部分国家元首是发动政变或起义夺权而产生(如古巴前国务委员会主席菲德尔·卡斯特罗).
4480	-地,地-	2010年1月12日海地地震中三层中较高的两层倒塌.
4481	-家	于2004年12月,国家应变计划正式生效.
4482	-家	国家足球博物馆(TheNationalFootballMuseum)是英国的一座博物馆.
4485	第-	第五军军长杜聿明后在史迪威压力下兼任远征军代理司令长官.
4486	第-	此时,该军下辖第33师、第117师及独立第6旅,在苏鲁战区担任敌后战场对日作战和被共产党彭雪枫军偷袭,政府军伤亡惨重.
4487	-地,-手	当时的香港政府后来把香港以南的航线分予国泰经营,以北的则交予国泰唯一本地对手,怡和洋行属下的香港航空经营.
4488	-学,大-	1946年11月,国立中央大学迁回南京.
4490	-员,-学,大-,第-	中央人民政府任命潘菽(原南京大学校长)为校长,孙叔平(原南京市文教局长)为第一副校长,李方训(原金陵大学校长)为第二副校长,保留原南大、金大必要职员组织行政机关.
4491	大-	博爱校区的校门目前有两座-北大门、南大门,其中北大门也为博爱校区的主要校门.
4492	小-	目前博爱校区并无餐厅进驻,仅有理发部、外工房,不过周遭有许多小吃店,提供学生饮食的服务.
4493	-员,-家,重-	在这段期间内,有许多球员获选加入国家青年代表队,毕业后也陆续加入各甲组足球队,成为国家代表队的重要来源.
4494	-学,大-	屏东农业学校与台北帝国大学(台湾大学前身)、师范学院(台湾师大前身)、台中农学院(中兴大学前身)、台南工学院(成功大学前身),时为台湾五大学府
4496	-学,大-	1955年国立清华大学于新竹复校,1965年恢复物理系大学部.
4499	大-	自从2004年提出了兴建人文大楼的构想,企业界陆续有人提供捐款.
4501	-学	台大医学人文博物馆是一栋两层楼的建筑,沿中山南路与仁爱路成L型.
4504	超-	其中参赛者年龄不可超过18岁(以当年7月1日为准),且必须就读于中学校(SecondarySchool).
4509	-家	图波列夫设计局在1960年代末期推出图-154客机后,图波列夫便成为社会主义国家民航飞机的主要供应商.
4512	可-	可是,魔牛肝菌的菌肉在被切割或撞伤后会变成蓝色的,而这种菌的菌肉无论如何都是白色的,因此透过切割菌肉便能分辨二者.
4514	-化	自然界的土是由岩石经风化、搬运、堆积而形成的.
4515	-们,可-	毛泽东早在1949年3月中共七届二中全会的报告中就明确地说:「占国民经济总产值90%的分散的个体的农业经济和手工业经济,是可能和必须谨慎地、逐步地而又积极地引导它们向著现代化和集体化的方向发展的,任其自流的观点是错误的.」
4517	重-	土壤是重要的自然资源和生产资料,土壤的植物生产能力是衡量土壤资源质量的标志.
4521	-家	2007年7月6日,圣乔治教堂被马来西亚政府列为50个马来西亚国家宝藏之一.
4525	-度	总面积14平方公里,人口268人,人口密度19.1人/平方公里(2009年).
4527	大-	除了在1900年到1950年间人口上升了大约25%,在此后人口一直下降,现在圣奥斯瓦尔德乡的居民总数比2005年还要少大约35%.
4528	大-	2007年,教堂完成了主体大修工程,工程包括内部结构的调整.
4531	-度	岛屿长度约为11公里,宽度6公里.
4534	-学,重-	后来他重回桥梁道路学院教学,并继续他的研究工作.
4537	-度	1914年,政府允诺减少在南非对印度人的歧视.
4538	-地,-度	但是甘地更相信尼赫鲁能建立保障印度人民自由的政府.
4539	-度,高-	在艾哈迈达巴德建立了SabarmatiAshram(高僧修行所),还有报纸「年轻的印度」(YoungIndia).
4540	-们,-地	除了抵制英国产品外,甘地还极力鼓励人们抵制英国学校,法律机构,辞退政府工作,拒绝缴税,抛弃英国给的称号和荣誉.
4541	-们,-员,-度,可-	1941年,一些反法西斯的社会党和民主党成员再度进入圣马利诺大议会,他们秘密组建了一个反法西斯的政治运动,这个运动越来越严密、壮大,到1943年时已经成为一支可观的政治力量.
4542	-家,难-	国家博物馆和图书馆收藏的文物和书籍转移到山洞里,以为难民腾出住宿空间.
4543	-度,大-	面对南下的德国大军,圣马利诺共和国再度陷入惊慌之中.
4545	地-	20世纪后,飞机被发明,航空测绘地图兴起.
4546	反-	但在2006年由于公众反对,这一计划受到搁浅.
4547	-家,地-	在此之后,地形图集也成为了现代化国家在规划基础设施和矿产探测中的基础国家资源.
4548	-度,高-	换句话说,如果每个标注的点都在100米的高度,这条线代表的就是100米海拔.
4549	-者,大-	滚球的球主要分为两类,一种由金属制,另一种则塑质所造,前者称金属滚球,后者名为塑质滚球,在这两大类中,再有小金属滚球、草滚球、桌掷球(又称沙狐球).
4550	地-	地湾城遗址,位于中国甘肃省金塔县,为一个省级文物保护单位,类型为古遗址.
4551	可-	与其他胰岛素相比较,本品引起夜间低血糖的风险较低,因而可以进行更为积极的剂量调整以实现血糖达标.
4552	可-	长期血糖水平控制良好可以降低糖尿病视网膜病变的风险.
4553	-化	《进化特区》(英文:Evolution)是2001年首映的一部美国科幻喜剧电影.
4554	重-	游戏的任务重心就是「自由」.
4555	-化,-子	NX-01最初的武器装备只有等离子炮与氚核鱼雷,并由电磁极化船甲保护.
4556	-化,-子	但在另一方面,少数变化使得分子的复制变得更快或更佳;这些「品系」的数量较多也较「成功」.
4558	地-	18世纪到19世纪是现代地质学和地理学的创立时期,两者的交叉领域则为地貌学提供了空间.
4559	地-	20世纪50年代也是地貌学出现分支学科的时期,形成了河流地貌学、冰川地貌学、海岸地貌学和构造地貌学.
4560	-子,-学,反-	化学中的场效应(Fieldeffect,记作F)是指通过空间的分子内静电作用,即某取代基在空间产生一个电场,它对另一处的反应中心发生影响.
4561	-头,-者	她并不十分擅长为唱片封面拍摄,每当摄影师把镜头对准她,说道:「好,开始拍」时,或者是在确定拍摄场景后,需要根据摄影师的想法去调整姿势时,她总是显得不自在.
4562	非-	总之她对颜色的要求非常严格.
4563	高-	此法既能解决运费高昂的问题,又可调节物价.
4564	-地	波利比奥斯记述道:「当其被不断切割,生还者被逼站在原地引颈就戮.」
4565	大-	总括而言,整场战役的总伤亡人数大约为八万人.
4566	-度,-性	总面积11.37平方公里,总人口1579人,其中男性741人,女性838人(2011年12月31日),人口密度139人/平方公里.
4568	高-	他是一个典型的战士:高大,结实,强壮有力.
4569	-子	统治期内,梅葛处死了三位大学士;他还拥有为数众多的妻子,每个时期通常都不止一个,因此臭名远扬.
4570	-性,第-	雷妮拉的母亲没有生下男性继承人就死了,所以韦赛里斯一世准备让雷妮拉继承王位,成为坦格利安家系中的第一位女王.
4571	-手	由节目来宾各自抽签选定主持人当助手后分成两队比赛
4572	-家	他亦曾代表过阿根廷国家队出赛,但并未参与任何世界杯赛事.
4577	重-	起初隆美尔对此决定甚为恼怒,但回到司令部后重新考虑过后,隆美尔认为魏斯法尔的判断是正确的,中止了攻势.
4579	-们,-化,第-	几个月后的一次采访,艾米说到:「如果我们没有变化的话,是没法做出第二张专辑的.」
4582	-学	卡斯特罗出现在了埃连与同学在一起的生日派对视频中.
4585	第-	1918年,他被派去指挥占领白俄罗斯的第十军,在那里他一直待到战争结束.
4590	-学,重-	随著年代的变迁,城堡设计的美学因素越来越重要,城堡的外观和规模开始体现它的居住者的威望和权力.
4595	-们	我们已经提及了连续偏序集合和代数偏序集合.
4596	-化,重-	另一种观点认为,两种复制的基因同样都会累积退化的突变,基因重复的缺陷也能相辅相成.
4597	超-	他感到自责,认为这样的复仇超过了应有的界限.
4598	-地,大-,高-	在格连推动之下,大陆军在12日决议即时撤出纽约,优先把伤兵及补给送到哈林高地,并由以色列·普特南的4,000人殿后.
4599	-地,高-	翌日(9月16日)一支英军向北侦察时与美军交火,引发哈林高地战役.
4600	-头,小-	英军军舰向基普湾狂轰滥炸近一小时,使滩头浓烟密布.
4601	大-,重-	华盛顿希望先获得大陆议会准许撤退,然后把纽约市彻底焚毁;部分将军则主张死守纽约,等待英军正面进攻,以重演邦克山战役的战果.
4602	大-	长岛会战后,大陆军撤回曼哈顿岛,但在撤离纽约市一事上仍然犹豫不决.
4603	-家,-度	程序性给付是在要求国家必须提供一套制度,例如考试制度和选举制度等,其也与正当法律程序条款的要求有关.
4604	反-,可-,大-	主武器是20枚P-700花岗岩(厂号3M45)反舰飞弹(分装在20座垂直发射器里),可以击沉大型水面舰.
4606	地-	基督堂草坪(ChristChurchMeadow)是英国牛津一个著名的洪水草甸,和著名的步行和野餐地点.
4607	-感	在报复的过程中,报复者会产生一种罪恶的快感.
4609	-度,地-	塔尔卡受地中海气候影响,有干燥的夏天和潮湿的冬天,每年平均降雨量749毫米,平均温度摄氏13度.
4611	-学	她是伊朗的巴比教有影响力的诗人和神学家.
4614	-学,-度	他先在印度西姆拉上学,后来毕业于加州帕萨迪纳的艺术设计中心学院.
4617	第-	这是阿齐兹的第一项死刑,他因1992年处死42名商人而被判15年有期徒刑.
4618	-地,-度,可-	塔里木盆地的塔克拉玛干沙漠流沙严重,从谷歌卫星图片可以清晰看到,沙漠腹地有些已建成的公路由于固沙措施不力,导致公路抵御流沙的力度不够,许多连接油田基地的沥青路面被强大的流动沙丘所淹没,阻断交通.
4619	小-	其中一处甚至涂有「小心恶犬」的标语.
4623	-度	詹姆斯和莫特对这项权益持相反的态度.
4624	地-	1896年至1973年间,该站为地上车站.
4625	-们	人们建造了一个纪念公园,并且为受害者放置了纪念石凳.
4626	重-	古罗马人利用拱结构来支撑桥身石材与水流的重量.
4627	-们,-家,老-	不过有些会影响到玩家的游戏体验的老版程序错误,我们不得不修复了它们,所以有些原版《时之笛》存在的bug将不复存在.
4631	-地	2000年代九广铁路计划兴建落马洲支线经过该地,引起了对该处生态影响的关注.
4632	-化	墨尔本在服饰、艺术、音乐、电视制作、电影及舞蹈等潮流文化领域引领澳洲,甚至于全球该领域范围都具备一定的影响力.
4633	-学,大-	2013年,历史悠久的墨尔本大学即将迎来自己的160周年校庆.
4635	小-	虽然这些小吃一般不被视作正餐,但即使作为前菜,有时它的丰腻也令人吃得很饱肚.
4636	-家,大-,超-	国际壁球联盟(IRF)于1979年由十三个国家共同成立,在努力推广发展下,80年代早期在五大洲就超过80个国家参与壁球的活动.
4637	-学,-度,可-	润滑剂中加入其它物质可以控制乳液粘度以及热学性能.
4638	可-	然后推杆就会推出所有的铸件,由于一个模具内可能会有多个模腔,所以每次铸造过程中可能会产生多个铸件.
4639	可-	熔融金属可以从这里进入模具,这个部位的形状同热室压铸中的注射嘴或是冷室压铸中的注射室相匹配.
4640	地-	因为这里是两条河川(士别川、剑渊川)汇合至天盐川的地方.
4642	-化	欧洲旅行是一件微不足道的事,景色乏味、清一色、缺少变化」.
4643	-度,可-	此理论既避免了浊送气音的不对称,也可以在一定程度上解释同源词在各派生语中的词形差异.
4645	-学,大-	1915年,时任校长李登辉改革课程体系,课程分成八大部类,其中哲学部为首,并亲自讲授哲学类课程;复旦大学逐渐建立起由逻辑、伦理、性理(包括心理学与形而上学)组成的哲学教学体系.
4646	-学,大-	2000年,成立复旦大学科学技术与社会发展研究中心.
4647	-性	2009年,贝拉克·奥巴马正式地邀请同性配偶及其子女出席复活节滚彩蛋活动.
4648	-学	后来,夏志明被伯明翰邀请接受测试,他参与了一场预备组赛事后,得知不会获得合约后决定于英国停学,于同年12月返回香港跟随杰志参与操练.
4649	-感	影片也从田纳西·威廉斯的《热铁皮屋顶上的猫》中汲取了灵感.
4658	-学,-者,可-,地-	科学家认为生命可能曾经存在过或者依然存在的地方包括金星、火星、木星的卫星(如木卫二、木卫六)、土星的卫星(如土卫六和土卫二).
4659	可-	你可以应用这种逻辑系统作为模糊集合论的理论基础.
4660	多-	多利纳是乌克兰的城市,位于该国西南部,距离伊万诺-弗兰科夫斯克州58公里,由伊万诺-弗兰科夫斯克州负责管辖,始建于979年,面积27平方公里,2011年人口20,453.
4662	大-	神经元传递信息,形成思维和感觉,以使大脑控制身体.
4664	-手	次日,近卫首相宣言「不以蒋中正为谈判对手」.
4666	第-	此套电影引起了一位名叫马徐维邦的中国人兴趣,他把此电影拍成华语版,不单引起更大的轰动,而且更为中国电影史上第一部恐怖片.
4670	-们,第-	他们也需保守有关他们关系的秘密,相较美朱在第一集跟鬼宿表白,这种关系显得比较成熟.
4672	-儿,-子,老-	秦月香为保护女儿采青误杀桑老三,被知县萧汝章利用,将月香的旧主子、采青生父青城富商沈渊卷入是非漩涡.
4673	大-	大义(1360年五月-十二月)是元朝时期陈友谅的年号,共计8个月.
4674	-化	中国的塔什库尔干塔吉克自治县有波斯人聚居,流行波斯文化.
4675	-们,-地	在前伊斯兰时期,伊朗人将他们的土地划分为两个主要部分,分别是伊朗及安勒尼兰(Aniran).
4678	-员,大-	大佛口亦为湾仔区议会其中一个选区,现任议员为亲建制的民建联成员李匀颐.
4679	-地,大-,重-	大兴邨位于今天和平区桂林路与衡阳路之间的重庆道上,总建筑面积为5900平方米,其中占地面积为6100平方米.
4680	大-	大同宝宝是台湾的大同公司于1969年推出的吉祥物.
4681	大-	也就是说,该航程主要吸引美海军战斗机向大和攻击队迎战,缓和对日本特攻机的攻击.
4683	第-	往返的航程中,第一砲塔因美军的轰炸而中了4枚炸弹,但对后续战斗没有影响.
4684	-手,大-,小-	唯一出现的人类角色,也是养育大嘴鸟的人,角色原型是凡尔纳的小说环游世界八十天中名为「万事通」的助手.
4685	-头	龙头由藤条屈曲为骨架;龙牙以锯齿的铁片造成;双眼是手电筒;舌头是漆红的木片.
4686	-化	在活动期间,该县被广东省文化厅授予广东省「汉乐之乡」称号.
4687	小-	此作也被改编成真人电影、小说、动画等.
4688	多-,大-	大孔多孔菌,属多孔菌科一种,是木栖腐生的中小型菇类.
4689	地-,大-	大安国际大楼是位于台湾台中市南区忠明南路上的一幢摩天大楼,楼高151.2米,共地上42层,地下4层.
