1506	第-	两个人的第一次相遇,是在某一次的会议上.
1508	-家	在1928年与1929年他在位于首都华盛顿的国家标准技术研究所工作,并在1929年受雇于贝尔实验室.
1509	地-,第-	沃斯托克站由苏联第二南极考察队(2ndSovietAntarcticExpedition)建于1957年12月16日,时值国际地球物理年(InternationalGeophysicalYear,IGY).
1510	-子	他的研究专注在冷原子的捕捉,以使这些原子接近绝对零度.
1511	-子	克特勒在攻读博士学位期间,证明了氢化氦(HeH)的存在,并首次获得这种分子的光谱.
1512	-学,大-	柏林洪堡大学把这篇论文评为最高等级----特优.
1513	重-	这虽只是一篇毕业论文,但它对航天事业的发展意义重大.
1516	第-	第二年,沈攸之果然战败自杀身亡.
1517	大-	11月25日,应苏联红军要求,中共中央东北局离开沈阳,中共中央提出「让开大路,占领两厢」的方针,中共党政军机关和部队分别向沈阳市郊陈相屯、财落堡和毗邻的县城转移.
1519	可-	在一部日本电影里可以看到,日本国内的报纸开始连篇累牍探讨「新满蒙现象」,讨论为什么东京的城市建设比不上沈阳,可见沈阳当时的城市建设规模.
1520	地-	罗丹用此形象来象征诗人但丁,也象征罗丹自己,甚至全人类,该雕像表达了但丁对地狱中的种种罪恶以及目前眼下的人间悲剧进行思考,在对人类表示同情与爱惜的同时,内心也隐藏著苦闷以及强烈的思想矛盾.
1521	-们,地-	此后他们将成为该地区的主角.
1523	-化	待未来善化车站增设月台完工后,沙仑线列车即可在善化车站办理客运.
1526	第-	旅游是目前的第二大经济来源.
1527	-学,大-	科恩出生于英国伦敦哈默史密斯,毕业于剑桥大学基督学院历史系.
1529	-子	沙河是流经中国四川省成都市城区东北部及东郊,属岷江水系,起止点为金牛区洞子口和锦江区河心村,干流长约22.2公里.
1530	第-	一般而言,很多人都将沙滩车的发明归功于一位加州设计师,布鲁斯·麦尔斯(BruceMeyers),但实际上连麦尔斯本人都曾在接受访问时表示,他并不是第一个发明沙滩车的人.
1531	-地	城门河是沙田休憩用地的中枢,两岸设有公园、长廊、单车径和其他康乐设施.
1533	-度,高-	这一放弃进攻罗马城的举动无疑为这位匈奴王赢得了赞誉,也使其个人魅力上升到更大的高度.
1534	地-	对于九州防御战,日军采取了一个折衷策略,即仅将防守部队撤退到离岸边几公里的地方.
1537	-度,高-	河北省是铁路和高速公路密度最高的省份之一,是进出交通枢纽北京的要道.
1538	-头	目前在岗教师394人,省级及其以上骨干教师、学科带头人和名师70余人.
1540	大-,第-	《河流》是蔡明亮的第三部电影,于1997年上映,同时也入围第47届柏林影展正式竞赛片,并获得第二大奖评审团大奖银熊奖.
1542	地-,高-	警署内铺有柚木地板,墙身有西式装饰物,勾形中间点的顶层房间,楼底高达十多呎,相信是最高级警官的宴会厅和宿舍.
1543	反-	这些内容明显反映了平沼骐一郎等司法界官僚的意图.
1545	-学,超-	尽管其研究范围超出了文学,但是译名紧贴原文是稳妥的办法.
1546	高-	但是,为了一劳永逸地解决高卢带来的威胁,罗马一直在寻找一种解决方法,最终,凯撒解决了这个问题.
1547	地-	自从二战以来,法国还是维持著自己的强权地位及联合国安理会中的席位.
1549	高-	至70年代摇滚乐进入高峰,不少乐队藉迷幻摇滚的兴起而成名,如Magma、电话乐队
1551	-学	在入学要求上,各院校规定不一,较常见的是要求申请人须拥有法学硕士学位或为法学硕士学位课程之应届毕业生.
1552	地-	但是印第安那和玛莉安在地下古庙中依旧想到了办法逃出生天.
1553	-们	印第安那趁机潜入纳粹的潜艇,随著他们前往一个孤岛.
1556	-化	然而在刚刚结束的文化大革命的影响以及当时的社会主义环境下,她千里迢迢前来追寻的东方文化却并非想像中那么触手可及.
1559	第-	选区始于1977年,因第十三任总理亚瑟·法登而得名.
1561	-头	法兰克原本是海洋航空815航班的机师,根据他的说法,他当日因为睡过头而被其他人取代了.
1563	-地	1901年,法兰克生于美国犹他州尤里卡,他的双亲迅速买下靠近爱达荷州波卡特洛的农地,法兰克便在当地成长.
1564	可-	2013年1月16日,为了纪念赞博尼出生112周年,Google搜寻引擎上的GoogleDoodle更换了图样,点击图示可以进行除冰机小游戏.
1565	大-,第-	《六月风暴》写的是第二次世界大战时,巴黎人嗅到战争气息而争相出逃的慌乱景象.
1566	-们,-员,可-	可是,空难主因肇于机员失误,因他们接收到飞机其中一个故障无线电导航的指示向右急速转向263度,机员即仓促地执行指令.
1567	-们,可-	可是他们并没有检查另一个导航器的指令,当时该导航器依然维持著稳定的状态.
1569	地-	在14至15世纪中,兹罗提原指为一种流通于波兰境内的外国金币,尤指德意志及鲁登尼亚地区的硬币.
1570	-学	一些科学家指灰狼及金雕、疾病及雌雄比例不均亦是其他因素.
1571	-们,大-	牠们的大小及毛色与西班牙羱羊相近,倾向褐色而非黑斑.
1572	第-	虽然红袜在第七场一开始就取得3比0的领先,但最终还是输掉了比赛,无缘世界冠军.
1574	第-	第二次抗议发生在1969年10月15日,有10万人参加.
1575	-度	城市后来作为盐和葡萄酒的生产中心再度兴起.
1576	第-	第二次保加利亚帝国建国之后,保加利亚再次兴起.
1579	-头	在公园东南部的尽头,森林公园步道系统的核心野木步道向西北方向穿过公园.
1582	-地	该物种的模式产地在印度尼西亚安汶.
1585	大-	同年12月29日,美国大陆航空订购10架787.
1587	可-	在可能的状况下,所有的出入口均应设在模具底部,若把冷却水孔设计在侧边则可能妨碍工作;同样把冷却水孔设计在上面如发生溢漏,则有可能冷却水进入到模具内部塑胶成型位置.
1589	地-,非-	灾难对泰国的农业非常巨大,使得泰国失去世界主要农业国的地位.
1590	第-	船上最为奢华之处是头等舱的大楼梯,位于第一和第二烟囱之间.
1592	可-,高-	铁达尼号的二等舱甚至是三等舱的居住环境和休息室都同样高档,甚至可以和当时许多客轮的头等舱相比.
1593	-子	1657年他的儿子奥朗则布篡位,沙迦罕被囚禁于阿格拉堡,城堡四围有护城河,长达2.5公里,墙高20余米.
1594	-员,-度	1857年,印度发生暴动,英国士兵和政府官员从泰姬玛哈陵的墙壁中任意凿出宝石和青金石.
1595	小-	泰姬陆附近不准停车,游客要步行,或搭乘电动车,允许带小型摄影机,照相机,和手机.
1596	小-	本社区共有2018户,总人口5557人,划分为34个居民小组.
1597	第-	2007年3月22日,神达电脑宣布与泰安电脑合并,换股比例为神达电脑1股换泰安电脑1.26股,预定在该年第三季完成换股,泰安电脑将成为神达电脑旗下事业体,泰安电脑的品牌则由神达电脑继续经营.
1599	-儿,大-,第-	同年11月27日,泳儿于九龙湾国际展贸中心StarHall举行了比感应泳儿音乐会更大型的音乐会----泳儿CloseToYouLive音乐会,此音乐会在其后同样与感应泳儿音乐会一样,分别收录在同名专辑《泳儿CloseToYouLive音乐会》和《CloseToYou》第二版中.
1600	地-	泽普农场,是中国新疆维吾尔自治区喀什地区泽普县下辖的一个乡镇级行政单位.
1603	-地	洛夫森山上有1158个植物物种,其中更有4个物种是当地特有的.
1604	-度,超-,高-	洛恩是瑞士的城镇,位于该国东部莫埃索河右岸,由格劳宾登州负责管辖,面积8.17平方公里,海拔高度1,480米,2011年人口46,超过一半居民使用罗曼什语,人口密度每平方公里1人.
1605	可-	以2007年春为例,新招募的警察可以获得$5,000到$10,000的签约奖金.
1607	第-	洛城警署有广泛的资源,包括全国第三大的民用空中力量.
1612	地-,重-	洛桑火车站,是瑞士沃州洛桑市的一个火车站,为一重要的地区际车站.
1614	初-	洛辛堡足球会(RosenborgBallklub(RBK))是一间位于特隆赫姆的挪威足球球会,于1917年5月19日成立,初时称为奥特(Odd),到1927年才改名叫洛辛堡.
1615	地-,高-	洛阳轨道交通1号线规划全长22.97公里,其中高架线路长1.40公里,过渡段长0.47公里,地下线长17.45公里.
1620	-员,地-	光绪十八年(1892年),帕米尔中俄争界案,洪钧由于不懂俄文,使用了俄制地图,遭到官员们的联名弹劾.
1621	-化,-性	它能从污水中去除溶解性的和胶体状态的可生化有机物以及能被活性污泥吸附的悬浮固体和其他一些物质,同时也能去除一部分磷素和氮素.
1622	-度	经过沉淀浓缩的污泥从沉淀池底部排出,其中大部分作为接种污泥回流至曝气池,以保证曝气池内的悬浮固体浓度和微生物浓度;增殖的微生物从系统中排出,称为「剩余污泥」.
1623	地-	活水泉教会成立于2009年9月6日,主要服务于西岛及附近地区的华人社区,以中文普通话为服务语言.
1624	-化	而现代日语中形容动词的活用分为两种,都是从古典日文用法变化而成的,分别介绍如下.
1625	-们	他们也控制了美国77%的财富,具有2万亿美元的购买力.
1626	-度	此外,也有更多的著作,虽然并未宣称隋代的这个「流求」是现在的琉球,但是却对「将隋代流求视为台湾」的这种见解,抱持著相当不以为然的态度.
1627	-们	人们围坐在溪水周围,把置有酒杯的托盘放在上游的水面,任其沿水流漂流.
1631	-者	这三位学者早年都参加过反清复明的军事斗争,失败后都致力于学术.
1632	-学,-家,重-	浙东史学,是中国古代一个重要的史学学术派别,也是儒家学术派别之一.
1633	-学	学院每年接受200余名中国政府奖学金留学生.
1634	高-	它位于西高止山脉的下风侧,西高止山脉如同一座屏风一样挡住阿拉伯海吹来的潮湿风.
1635	高-	浦那海拔560米,位于德干高原的西部边缘.
1636	大-	OVA版本的追忆篇内容虽然与漫画原著并无太大出入,但其风格却与之前的电视动画版大大不同.
1639	大-	海上世界站的结构共分两层,其中一个岛式月台设于下层,而上层则为车站大堂.
1642	-子	她曾经19次夺得网球大满贯冠军,其中包括创纪录的夺得8次温布顿网球锦标赛女单冠军,她也被认为是史上最伟大的女子网球运动员之一.
1645	-化	在这时期,海上战争的发生地也开始从欧洲海域转往远洋,因此对船舰的耐航性与作战能力的要求跟著提高,船舰吨位增加、武器强化并引用钢铁装甲,在资本主义和工业化的迅速发展下,舰队与武器快速进步.
1647	可-	虽然有的任务可以全权由国王委派的长官指挥,但这些都是调动兵力较少的小行动,无法应对大规模的作战.
1648	-地	该物种的模式产地在海南五指山.
1649	重-	2004年,海航集团向民航总局申请发起重新组建旗下的航空企业,组建中国新华航空集团.
1650	-地	新华航空的营运基地将设在北京首都国际机场.
1651	可-	海因茨·伦敦于1970年死于癌症,可能是因为他是一个老烟枪.
1652	-度	亨利·克里斯多夫还创建了贵族等级制度,册封了4个亲王、8个公爵、22个伯爵、37个男爵和14个骑士.
1656	反-	2002年,伊拉克,尤其是萨达姆·海珊,成为美国反恐战争的目标,这最终导致了2003年的美伊战争.
1658	大-	其中包括武器中有贫铀、油田大火和炭疽疫苗.
1659	-者,地-,大-,第-	为方便长者及残疾人士,海湾花园客户服务中心于2011年购置一部电动楼梯机,并放置于第3座地下大堂中,供有需要人士借用.
1660	地-	2010年10月,海盗湾宣布,计划发射用卫星将一个BT网站发射到地球轨道上.
1661	-们	旅程中,他们在营帐睡觉,并且自行生火煮食.
1663	高-	海螺沟背依贡嘎山,以低海拔现代冰川、大冰瀑和高山温泉而著称.
1664	第-	第一则故事是,海神波塞冬欲娶海仙女安菲特里忒为妻,然而,为保贞洁,安菲特里忒逃至阿特拉斯山脉.
1666	-地	涅尔皮奇耶湖是俄罗斯的湖泊,位于科雷马河左岸的科雷马低地,由萨哈共和国负责管辖,面积237平方公里,湖水主要来自雨水和融雪.
1670	-化,地-,大-	现时在亚洲地区使用的液化天然气,主要是开采自澳大利亚西北部的大陆架上的天然气田,该气田由必和必拓、英国石油、雪佛龙、三井物产、三菱商事、蚬壳集团和Woodside七个企业共同拥有.
1671	-头,大-	对于制作团体自身而言,片头曲和片尾曲其实都能够演绎角色,跟大多动画公式的低成本分镜演出和预算截然不同.
1674	重-	所有淋巴管最后汇集成两条主要的大淋巴管,包括胸管与右淋巴管再注入静脉而重新进入血液循环中.
1675	-者	在台湾,有网购业者趁故事窜红推出以「淡定」作品牌的红茶和T恤等商品.
1676	-化,高-	辖境相当今江苏省宝应、金湖、兴化等县市以南,扬州、泰兴、南通等市以北,高邮湖以东至海.
1677	地-,高-	在月台形式上,典型的深圳地铁车站为岛式月台车站,即使高架车站亦采用岛式月台.
1678	地-,高-	地下车站通常为地下2层的箱型结构,高架车站则采用3层的门式结构.
1681	小-	小型货车是指轻型或微型货车、牵引车、专项作业车.
1684	-手	日本麻将中,清一色和混一色统称为染手.
1685	地-	清兵入塞一直被视为明朝灭亡的主因,盖因在己巳之变前,满清的叛乱范围一直控制在辽东地区,并没有越过长城.
1687	-地,-头,可-,地-,大-	土司的长官以当地各族头人充任,可以世袭,由朝廷或地方官府颁给印信,归所在地方之督抚、驻扎大臣管辖.
1690	大-	1727年雍正五年正月,清世宗派遣内阁学士僧格、副都统马喇驻喇萨,「与达赖喇嘛、康济鼐、阿尔布巴等和衷办事」,并设立驻藏大臣衙门.
1693	第-,重-	镇朔楼于1996年列为第四批全国重点文物保护单位合并项目,归入清远楼.
1695	可-	在古英语,字母þ和ð都可以表示清齿擦音或浊齿擦音.
1696	-子	古埃及人使用竹子制作的渔梁篮子在尼罗河捕鱼.
1697	-子	渠子乡是中国陕西省咸阳市永寿县下辖的一个乡.
1698	-们	在月色寒冷的夜晚,两人想起了和绀三郎约定的事情,正打算要出门时,被哥哥他们知道了.
1699	大-	渤海大楼内部设一部电梯,连接一层和二层主要供店铺使用的四个形式不同的小楼梯、一条从一层直通八层的主楼梯、一条九层至顶层的螺旋式小楼梯以及一条顶层至云亭的铁爬梯.
1702	地-	温州教区是循道公会在华传教最成功的2个地区之一(另一个是以云南昭通为中心的西南教区,信徒大部分是苗族).
1703	地-	温暖海岸(CostaCálida)是指西班牙穆尔西亚自治区长约250公里的地中海海岸线.
1704	-们	已婚妇女弗特和莱希女士发现她们两人同时收到破落贵族法斯塔夫的情书.
1705	-子	那位老骑士就被硬著逼到洗衣篮子里躲避.
1707	地-,大-	2008年1月7日,摩根大通与太古地产签订协议,承租港岛东中心11层共23.7万平方呎,成为港岛东中心的最大宗租务交易.
1709	第-	为了进一步纾缓鲗鱼涌站转乘的挤迫情况,政府提出了「纾缓鲗鱼涌站乘客挤塞工程」,决定扩建北角站,使之成为当时第二个接驳观塘线的港岛线车站.
1711	-度,老-	通常以英国人为老板,华人及印度人为跟班.
1713	地-	曾经,香港地铁的各种标志、站名、方向指示,其中文字都使用此字体.
1714	-度,超-,高-	其车体强度具有150吨抗挤压能力,比常规水准高出70吨,相当于时速200公里高速列车车体强度;车辆于噪音控制运行状态下客室噪音不超过65分贝.
1716	-头	虽然车序一般而言不会变更,但如果有以下情况,控制中心或会要求部份或所有列车更换车序,或改派另一列车行走特定车序,原有列车退出营运:港铁列车(东涌线、机场快线及迪士尼线除外)会在车头及车尾显示该列车的车序.
1717	第-,重-,高-	游仙寺位于中国山西省高平市河西镇宰李村游仙山,2001年被列为第五批全国重点文物保护单位.
1719	-学,大-	2003年,学校升格为专科大学,改名为「湖南民族教育职业学院」.
1720	-地,-度,重-,非-	南方都市报说,当地儿童家长非常愤怒,在多次上访得不到当局重视的情况下,村民一度在公路上设置路障后才引起当地政府的重视.
1722	-学	2001年,科学家在尼欧斯湖安装了一根排气管,2002年则在莫瑙恩湖安装排气管,用来抽取深层湖水中含有的气体,降低湖水中的溶气量,降低这种自然灾害再次发生的机率.
1723	-家,-手,老-,非-	佩琪的母亲,在圣路易斯时是个料理老师,在料理方面是非常能得心应手的专家.
1724	可-	她的家里有好几位可以使唤的佣人.
1725	-度,第-	源田实作为第一航空舰队航空参谋参加了太平洋战争中偷袭珍珠港,印度洋海战,中途岛海战等航空作战.
1726	-们	人类到达它们生活的岛屿之前它们没有天敌,因此没有防御措施.
1733	地-	温特夸特斯湾是南极洲的海湾,位于麦克默多湾,处于纽西兰以南3,500公里,最大水深33米,由罗伯特·斯科特率领的英国探险队划入地图.
1737	-热,可-,大-	不过,汇丰市值庞大,令股价长期不动,投资界把它叫作「大笨象」,当「大笨象」的股价急速起飞时,外界往往视此为利好消息,或股市走势可以炽热的信号.
1740	-们,-学,大-,小-	故事叙述主人翁高松翔在一次莫名的大爆炸中,连同整所大和小学师生862人一同来到了荒芜的未来世界,他们必须面对彼此的猜忌、各种恐怖的怪物袭击与根本不晓得能否安然返回本来世界的绝望感活下去.
1741	-家	新达尔文主义产生于19世纪末,创立者是德国生物学家魏斯曼.
1742	-员,第-	《演员的自我修养》完整出版的有第一部和第二部.
1743	-感	人是无法随时地让自己体验各种情感,并让自己的外在形体表现出来.
1745	第-	第三阶段从汉武帝太初二年(前103年)的浚稽山之战开始,至汉宣帝本始三年(前71年),由汉援乌孙击匈奴之战而结束,汉遣5将军率160,000骑兵,乌孙发兵50,000骑兵,共击匈奴,取得了对匈战争的胜利.
1746	-地	日文中的南北朝鲜专有名词会以汉字表示,并且在汉字之上用片假名注明当地(朝鲜语)读法,但越南的固有名词则几乎完全不用汉字表示.
1747	-化	联合国及各国际组织也都采用了简化字.
1748	-员,地-	而伦拜的音乐勤快而富节奏感,他往往在城市有节庆时谱写音乐,并往往题献给皇室人员和地方权贵.
1750	-家	便服是指居家或进行体力劳动时的服装,多为窄袖,以裋褐为代表.
1753	-学,大-	其校区背靠马鞍山麓,并被西洋坪路、大学西路、学府路这三条公路所包围.
1754	-儿,高-	她在16岁时便怀孕,并与她自高中开始交往的男友CaseyAldridge订婚,并诞下女儿MaddieBriannAldridge.
1755	-度,多-,高-	潘丘是罗马尼亚的城镇,位于该国东部,距离首府福克沙尼30公里,由弗朗恰县负责管辖,面积61.85平方公里,海拔高度258米,2009年人口8,682,大多数居民信奉东正教.
1756	-学,大-	另外,他曾摘下东亚运动会和世界大学生运动会的银牌.
1758	大-	1928年12月29日,潘复在东北易帜中正式下野,下台后先后在大连、天津居住.
1760	-地,地-	当地地形特征在正式命名前有暱称称为「蜘蛛」.
1761	-化,-者	如在柴电动力的基础上自带氧化剂或者是其他不需要氧气助燃的设备,或是由新的动力来源为电瓶充电与驱动电力马达.
1762	可-	采用呼吸管之后,潜艇只需将呼吸管伸出海面就可进行充电,不仅降低了潜艇被发现的机率,也扩展了潜艇可以充电的时机.
1763	-员,-子,-学,反-,可-,第-	潜望镜利用光学镜面反射的原理,在一个长管子的两端安装镜片,上端的镜片会将面对的影像向下反射,位于底部的镜片将反射过来的影像作第二次反射,观测人员透过底部的反射镜就可以看到上方镜面对准的方向上的影像.
1765	可-	当潜艇下潜时,潜艇壳体通常可以承受的水压可以达到4兆帕(相当于400米水深的压强),而对于像阿尔法级核潜艇那样的钛合金外壳的潜艇则可以承受10兆帕的压力(相当于1000米水深的压强).
1766	-化,-家,大-	传说刘秀、岳飞大将牛皋、苏东坡、朱元璋、臧克家等历史文化名人都在潢川留下过故事.
1767	地-,大-	潭村站,规划时曾称为赛马场站,是广州地铁五号线的车站,位于天河区花城大道广州赛马场南侧的地底.
1768	-头	潭西镇下辖潭阳社区、潭西村、东山村、崎头村、长安村、崔陂村、潭东村、深溪村、溪美村、恢丰村、深港村、铁炉村、上埔村、新埔村.
1769	-家	澳洲皇家海军是澳大利亚国防军的海军分支.
1771	-地	「州」和「领地」是中文里的通用译法,但也有其他译法.
1772	-子	车站所在地名为「挖子」,但在正式通车时,却以澳底为名.
1773	-度,多-	自1851年到1863年,澳葡政府曾对博彩场所实行发牌制度,赌档曾一度多达二百余家.
1775	-化	直至2003年,澳门的总绿化区面积为5,799,407平方米,其中澳门半岛有1,004,577平方米占17.3%,离岛有4,794,830平方米占82.7%.
1776	-学	新校园在2014年全面投入使用时,学院将会增设至八个,包括人文学院、工商管理学院、设计学院、教育学院、健康科学学院、法学院、科技学院、社会科学学院.
1777	第-	第二版有次要社会新闻以及生活资讯.
1780	-化,初-,重-	印表机初始加电的热过程是定影熔化部分的重要过程.
1782	-头	还有一些伯公庙建于村头,常有大榕树遮荫,此类则以南山、广澳、葛朱的村头的伯公庙为代表.
1785	大-	自此以后,除了德川赖宣管治短时间之外,由不同的谱代大名管理.
1787	地-,大-	滨海阿尔卑斯行省是罗马帝国的一个行省,该地区于公元前14年成为罗马帝国的一个行省,大致相当于当今法国南部及义大利地区.
1788	-度	2011年度的1日平均上下车人次为28,169人.
1789	-子,大-,第-	1581年,辅佐信长次子信雄进攻伊贺,即第二次伊贺进攻,在善用兵的一益协助下,曾大败信雄的伊贺众只抵抗的不到半个月就被消灭.
1791	地-	1962年11月1日,前苏联向火星发射了火星1号,这枚探测器成功进入了前往火星的轨道,并且计划于1963年6月19日到达火星,然而当1963年3月21日它飞行到距离地球1.06亿千米的距离时,却与地面永远失去了通信联系.
1793	地-	在太阳系八大行星之中,火星也是除了金星以外,距离地球最近的行星.
1794	-手,超-	水手9号于1971年11月14日到达火星,在火星轨道上工作了将近一年之久,发回了7329张照片,覆盖了火星表面超过80%的部分,同时还对火星的两颗卫星进行了探测.
1795	可-	探测器在火星赤道附近降落远比在极区降落容易,所以人类未来在火星赤道附近殖民的可能性增加了.
1796	可-,大-	这时将产生大量的白色气体,而若是在封闭的空间内,产生的气体可以推进要发射的物体.
1798	-地	12月议会收到错误情报,指英军正前往朴次茅斯征收火药,保罗·列维尔即时乘快马赶往当地通报,而当地民兵则在约翰·朗顿(JohnLangdon)带领下掠夺了当地的玛利与威廉堡.
1799	大-	三国时期则出现了五熟釜,一只铜制的锅内分为五格,各有不同味道的汤料以涮煮不同的食物,与现在遍布大街小巷的鸳鸯火锅有异曲同工之妙.
1801	地-,大-	但是,金星的光会被地球的大气层和望远的镜片散射,使得观测者的工作难以进行,很难在正确的时间获得适当的影像.
1803	地-,大-	如果以港铁站之间的中线为界,炮台山包括铜锣湾街市以北,北角道北景街以西及北角半山的北角地区,大约北角铜锣湾各占一半.
1804	-子,地-,大-	点击书(DigiBook)是中国目前最大的电子书销售网站,也是目前中国大陆地区最大的从事正版漫画电子书的网站.
1805	大-	该庙大雄宝殿属于典型的藏汉混合式建筑.
1807	-们,-地,反-	据村民反映,在卖地的过程中,他们一不知情,二也没有得到过赔偿.
1808	-度	而这些地近年来大幅度升值.
1809	小-	她小心避开社交圈,也不涉及艺术界的生活方式.
1813	-子	成人每天摄取16毫克,女子为14毫克,发育中的青年为20毫克,怀孕期及哺乳期为18毫克.
1814	-头	鸡头和鸡腿部分比较脆,也是最受喜欢的部分.
1817	-热,高-	其原因是因为供热设备的功能是提供热能给高温热库,而制冷设备的功能是从低温热库中抽取能量,而输入功转换为热能,提供给高温热库,在供热设备中是有用的能量输出,而在制冷设备中只能视为所产生的废热,不是有用的能量输出.
1819	-热	用煤气或太阳能加热的热水器多为洗浴用提供热水,用电能加热的有为洗浴也有为饮用提供热水的.
